{
  "jobId": "11111111-2222-3333-4444-555555555555",
  "kind": "splat-finish",
  "status": "succeeded",
  "progress": 1.0,
  "stage": "done",
  "stageDetail": null,
  "message": null,
  "error": null,
  "createdAt": "2026-01-01T00:00:00+00:00",
  "updatedAt": "2026-01-01T00:00:00+00:00",
  "result": {
    "frame": {
      "scale": 1.0
    },
    "quality": "high",
    "stats": {
      "splats": 1000
    },
    "files": [
      {
        "name": "wall.splat",
        "url": "/v1/jobs/11111111-2222-3333-4444-555555555555/files/wall.splat"
      },
      {
        "name": "frame.json",
        "url": "/v1/jobs/11111111-2222-3333-4444-555555555555/files/frame.json"
      }
    ]
  }
}
