{
  "jobId": "0d9c2b7f5a6e4f3d8c1b2a0e9f8d7c6b",
  "kind": "splat-finish",
  "status": "succeeded",
  "progress": 1.0,
  "stage": "done",
  "createdAt": "2026-10-27T10:00:00+00:00",
  "updatedAt": "2026-10-27T10:04:00+00:00",
  "result": {
    "files": [
      "wall.splat",
      "wall.spz",
      "wall.raw.spz",
      "frame.json"
    ]
  }
}
